{
  "schemaVersion": 1,
  "name": "HTTP With Credential",
  "nodes": [
    {
      "id": "t1",
      "type": "manualTrigger",
      "name": "Start",
      "position": { "x": 0, "y": 0 },
      "parameters": {}
    },
    {
      "id": "http1",
      "type": "httpRequest",
      "name": "HTTP Request",
      "position": { "x": 220, "y": 0 },
      "parameters": {
        "method": "GET",
        "url": "https://httpbin.org/get",
        "credentialId": "cred-api-key-001",
        "authentication": "genericCredentialType"
      }
    }
  ],
  "connections": [{ "from": "t1", "to": "http1" }]
}
